{
  "report_version": "0.1",
  "core_spec_version": "0.1",
  "passed": false,
  "summary": {
    "total": 2,
    "valid": 1,
    "invalid": 1,
    "parse_errors": 0
  },
  "files": [
    {
      "path": "invalid.json",
      "valid": false,
      "errors": [
        {
          "instancePath": "",
          "schemaPath": "#/required",
          "keyword": "required",
          "message": "must have required property 'actor'",
          "params": {
            "missingProperty": "actor"
          }
        }
      ]
    },
    {
      "path": "valid.json",
      "valid": true,
      "errors": []
    }
  ]
}
